{
  "id": "DR-2026-002",
  "title": "Follow-up guardrails",
  "status": "proposed",
  "date": "2026-01-20",
  "owners": ["architecture"],
  "context": "Need stronger linkage to delivery quality policy.",
  "decision": "Require stage command references in every directive record.",
  "consequences": "Records without canonical links fail CI.",
  "canonical_refs": [
    "docs/dod_manifest.json",
    "docs/system_contract_map.md",
    "docs/process/quality_stage_commands.json"
  ],
  "evidence_commands": ["pytest tests/test_decision_record_schema.py"],
  "ci_policy": "blocking",
  "supersedes": ["DR-2026-001"]
}
